{
  "schemaVersion": "1.0",
  "contextId": "code-under-review",
  "taskId": "review-existing-code",
  "path": "src/",
  "kind": "source",
  "profiles": ["lead", "check"],
  "priority": 100,
  "mustRead": true,
  "summary": "Code under review",
  "digest": "sha256:0123456789abcdef",
  "updatedAt": "2026-08-10T08:00:00.000Z"
}
